sentence,mood,seed_words,seed_words_mood
gone with master luke than stay here with you well,positive,gone with master luke than,positive
told you artoodetoo you know better than to trust trust,trust,told you artoodetoo you know,neutral
were coming out of the asteroid field has direct to,anticipation,were coming out of the,anticipation
this thats why ive also been programmed to make up,neutral,this thats why ive also,neutral
communicate but it has the most peculiar dialect i believe,positive,communicate but it has the,positive
has been rather a longtime on you master luke is,positive,has been rather a longtime,neutral
get me onto one of those youre going to get,neutral,get me onto one of,neutral
oh my id forgotten how much i hate space travel,fear,oh my id forgotten how,fear
wait oh dear artoo artoo artoo artoo you might to,positive,wait oh dear artoo artoo,positive
